datetime,subreddit,body
2021-02-02 03:14:14,aliens,"Yup. I dont think anyone on this sub thinks that life has singularly manifested on this planet alone and this entirety is just the canvas on to which the human experience is to be played out but we REALLY need to reign this shit in, it's devolving us. Think how stupid the ""average"" person is, then realise HALF the species is even more dense and here we are, propping up our inherent cognitive fragility for complete and utter strangers on the internet. (I don't mean to rail on you OP I'm sure you're the one in seven billion ish that's actually telling the truth and you do in fact ""know the Janet pilot personally"" and go camping with him on the regs in a cross generational breaking of his lifetime of oaths and silence round the campfire, it's not like a dj is an occupation that screams ""I need attention"" or anything don't be down Charlie Brown we all believe you're telling the truth *sigh*)."
2021-02-02 03:13:47,aliens,Uhh source?
2021-02-02 03:09:53,aliens,"Honestly I am certain in some cases they just tell people that because they know those around them consider them crazy anyway and won't believe. 

Especially in this day and age where it is easy to know what people think or believe in."
2021-02-02 03:07:35,aliens,"To be fair humanity as a whole isn't prepared for big leaps of technology achievements, look at how naive and gullible so many are due to social media... Its always us vs them to so many people that I don't feel humanity is even close to being ready for the truth, regardless of what that truth is."
2021-02-02 03:04:13,aliens,"Maintaining a network capable of tapping in to such energy has costs, the world is prepared to move on from oil dependence, they will find ways to easily make money despite low or free energy resources fueling it."
2021-02-02 03:03:18,aliens,Lol Greer hasn't produced anything even bordering on evidence for years. Let alone hard evidence. He's a con man. Just like Lazar
2021-02-02 03:02:05,aliens,[removed]
2021-02-02 03:01:17,aliens,I don't know what came over me. Every time I go there... And see that hammer (tequila bar)...
2021-02-02 03:00:49,aliens,"I agree with the notion that weed and psychadelics expand your consciousness which is why they are banned and alcohol is not. Weed and psychadelics change your way of thinking whereas alcohol in particular reduced the level of thought that goes in to things. I have no doubt that that plays a part in why drugs are illegal. They don't want us thinking outside of the box.

Despite this, I cant bring myself to believe that this is being enforced on us by reptilians without any proof to back up the claim. I wouldnt completely rule it out as nothing is impossible in this world but just seems like a bit of a stretch. The people at the top of the chain on Earth will want us to be in line more than any other alien species would"
2021-02-02 02:57:41,aliens,I can't fathom having a friend with such an interesting career and not being fascinated by it.
