datetime,subreddit,body
2021-02-03 11:17:28,aliens,"Canine dogsmology holds that the universe was created by the Big Bark, which constitutes both the warp and woof of Reality’s fabric….

See, a howl can encode information and act as a carrier wave. Usually it has a smooth, periodic dogscillation (a sinusoidal form, due to snout’s influence).

It’s very interesting how a bark can act as a carrier of information. The sound wave has a form distinct from the medium (air) through which it propagates...

It’s quite compelling, philosophically. Say you’re a character in an electronic software program: a “video game”. How can you know what hardware device performs the chomputations that render your world? Are you running on a Funfriendo GameSphere, a Pupstation, a Rex Box, a mobile handset device like an iPup, or even an office machine such as a photocopier? No way to know, since the program could be run on any system with suffficient chomputational capacity.

I actually learned a lot about this concept at the Hilltop Chowder School.

Stews are multiply realizable phenomena you see: substrate independent, higher-level patterns emerging from the aggregate soup-matter used in their creation. (Notice the similarity to the sound wave mentioned above.) 

Really, you and I are a sort of perpetual stew! Ingredients constantly changing out, getting chomped, getting added, leaving their flavor for weeks afterwards or longer..."
2021-02-03 11:17:27,aliens,Looks like WeenoRynus from the Photoshop Tribe! 🤣
2021-02-03 11:16:28,aliens,"Im on my phone so maybe my reddit is messed up. For me it just shows a bunch of deleted comments, and only like one or two other comments asking for links. Ill look on my pc when I get home though."
2021-02-03 11:15:01,aliens,"Nope, just a fan of MST3K."
2021-02-02 07:58:52,aliens,"Ok. The first and most important question would have to be.

Why does the taxi pilot who's job is to fly the work plane to and from area 51 shuttling the scientists to work and home again get access to all of that info? 

There seems to be huge amounts of technical knowledge in there from different areas of concern so are the people working on it telling him/her at lunch or what?"
2021-02-02 07:54:12,aliens,The person filming moves not the object.
2021-02-02 07:54:11,aliens,"Yeah, absolutely. It’s pure chance that I’m lucky enough to had found a job that I like, and a partner who I have a fantastic relationship with. Doesn’t mean I haven’t worked for what I have or that I’ll have to continue to work but it’s a product of luck nonetheless."
2021-02-02 07:50:07,aliens,Guess you must have been really lucky based on your own logic
2021-02-02 07:49:42,aliens,"They’re criminalizing nature because they can’t make a profit from something you can grow in your backyard. Follow the money. It’s an old story, and the same reason there are so many cures in the natural world that are never brought to light. If they can’t synthesize it, they can’t sell it. If there’s a cure, then they can’t sell the treatment. Now we’ve figured out we can tax weed, so that’s why it’s becoming legal. It’s all about money and control."
2021-02-02 07:49:28,aliens,"I’m already successful, I am not rich. I don’t measure my success in money, and I think it’s really sad if you do."
2021-02-02 07:48:06,aliens,Nothing about this surprises me. I’ve Already accepted the new reality.
2021-02-02 07:46:12,aliens,"What happened to grammar, and commas? I tend to believe people that can write appropriately."
2021-02-02 07:43:29,aliens,Humanity will never be ready as long as we are continuously fed lies and controlled.  The notion that people aren't ready is always used to rationalize humanity remaining stagnant.
2021-02-02 07:40:53,aliens,"Marijuana was made illegal in the first place because of racism, and a need to control the populace, basically.

https://drugpolicy.org/blog/how-did-marijuana-become-illegal-first-place

Psychedelics help a great deal with addictions, and why wouldn’t we want people addicted to things in this “capitalism”?"
2021-02-02 07:22:30,aliens,A very specific pilot easily identified person. I hope he's not under contract. The words Zeta Reticula are a specific term that can be used to match the person to their debrief.
2021-02-02 07:19:18,aliens,"I think the idea of actual reptilians is fun and everything, but what is usually being referred to is the reptilian part of the human brain. The argument is that there are some humans who operate completely in that mental space and some of those people control our world. they don't have the same concept of the value of human or animal life,  and they wouldn't have any problem destroying the environment. Those type of people are also highly manipulative and narcissistic. I think that's even more frightening than actual reptilians."
2021-02-02 07:18:05,aliens,WTF is cid?
2021-02-02 07:05:30,aliens,[deleted]
2021-02-02 07:02:18,aliens,"LOL ""race doesn't exist from a genetic standpoint""

Get real"
2021-02-02 06:58:53,aliens,The aliens have allowed themselves a crime to commit against us worse than death: entity attachment for total control
2021-02-02 06:55:06,aliens,[removed]
2021-02-02 06:51:59,aliens,"The religious/new reality bit got me questioning our existence. The universe was created with the Big Bang. Before the Big Bang, there was gas, but what exactly is this space we’re in? Why was there gas? How did it come to existence in the first place? I can’t help but think of bacteria forming in a Petri dish. And now that we know our universe is expanding, what is driving this outward pull? 

There must be some higher being(s) or forces at play here. Just like how we are the higher beings studying Petri dishes."
2021-02-02 06:49:13,aliens,this is copy and pasted from reddit before.
2021-02-02 06:42:08,aliens,"Well I can't speak for every single UFO, but aliens do have ships and they are in them and they have visited Earth over the years. I get that there is no proper proof or whatever people need to believe that right now, but moving onto telepathy. 

Depending on how advanced the alien is, they have tech that can do a lot of things, one of those things being telepathy if they have it. Of course there is also natural ability, but tech seems to be how they do a lot of things.

About what aliens look like, they don't all look the same, so they're not all going to look like grey's and one thing about aliens that doesn't matter is definitely sci-fi things. They have visited way before rise of UFO sightings or before them depicted in sci-fi.

Basically you can't just think something is fake about aliens just because it may be something similar to sci-fi is what I'm trying to say."
2021-02-02 06:41:05,aliens,"Yes, link please"
2021-02-02 06:39:00,aliens,"Suuurrreee... Because he would be allowed to know and talk about it publicly.  

Just because it comes from the horses mouth doesn't make it true.  

Look up Tesla and (elon) threatening employees. It gets pretty dark. Elon isn't as moral as you think he might be. Creative, innovative; yes. A good person... Ehh doesn't look like it. Honest? Ehh we don't know him like that."
2021-02-02 06:22:20,aliens,"Dude almost every single claim that Bob Lazar has made can be debunked. Plus he has been caught lying about stuff like his education. For example, he claims that he had a physics and an electronic degree from Pacifica University. But Pacifica University was shut down after it was discovered that it was just an office that sold fake degrees. He was asked in an 1993 interview who his University professors at MIT and CalTech were. I don't remember their names but I know that people found out that the people he named never worked at MIT or Caltech. They were actually teachers that he had in highschool and in college were there are records of him attending. 
Something really fishy about his story is how he says that the government tried to erase his records about where he lived... But there are still records of him attending highschool and college... Yeah right.
If his story was true then why would this guy feel the need to lie about his education? Maybe because he made it all up? And claiming that the gouvernement is trying to erase his records is a way to explain how there are no records of him studying at MIT or CalTech because he never studied there."
2021-02-02 06:18:59,aliens,Thanks for insight Reddit peeps 🙂^   The gears are turning hahaha
2021-02-02 06:16:26,aliens,"I had a friend join the Navy and was stationed in San Diego. She was intelligence. Just joined so low rank and she was telling me back on 07 about the tic tac phenomenon going on. Just super casual about it. So much so that nobody believed her, they thought she was screwing with them."
2021-02-02 06:15:51,aliens,Yeah but only dozens of times in this sub alone....
2021-02-02 06:15:42,aliens,">	I believe this with all my heart. It’s the only logical explanation as to why these things aren’t legal on every country on earth yet somehow alchohol is.

Man I love acid as much as anyone, but we all know that friend that got way too fried out and never came back. I don’t think we needed reptilians, just protective mothers"
2021-02-02 06:13:29,aliens,"Very true but humans are imperfect. What you say makes it much less likely but look at Bob Lazar. Dude spilled the beans on video. Why wouldn't another human who works on top secret projects, which im sure is overwhelmingly hard to keep to yourself, let a few details slip during conversation.

Just my train of thought."
2021-02-02 06:13:09,aliens,"One thing I think of is that if they’re telepathic, they might also be extremely sensitive to negative emotions and dark thoughts. Sometimes I wonder if that’s why they tend to appear to people like farmers who live uncluttered, honest lives, or school children (like the Ariel school)."
2021-02-02 06:11:40,aliens,"These remind me the San Diego Sphere, crazy sh\*t."
2021-02-02 06:11:21,aliens,"> I haven’t seen or heard anyone talking about this very much

Did you discover this subreddit just today or something? It's been talked about a lot."
2021-02-02 06:10:22,aliens,I'm not sure how to do so. I have no problem sharing but I'm not sure how to upload. Also given that it has been some time the left ankle has faded more than the right ankle.
2021-02-02 06:08:18,aliens,"I agree. When I heard it, I immediately thought of close encounters of the third kind, but I think “The Abyss” is a likely situation as well. For the most part anyway.  Also depends on how “A-List” the movie was.  There’s a LOT coming out of Hollywood.  Even possibly “Stargate”."
2021-02-02 06:04:58,aliens,"Need to know what movie they were talking about ha, listening to the George Knapp and Corbell episode if I hear anything I’ll let you know."
2021-02-02 06:04:24,aliens,[deleted]
2021-02-02 06:03:54,aliens,">when I asked him if Aliens are real he said ""I am not allowed to say,

But he told you about all that other shit?"
2021-02-02 06:03:49,aliens,"I meant that they very well could be telepathic, our scientists are already researching the tech, so it's reasonable to assume some aliens did the same, but the existence of extraterrestrials piloting the UFOs has not been proven yet. Ok, there are some recordings, photos and eyewitness testimonies, so there are some unidentified objects, flying with complete disregard to aerodynamics, they might be piloted by aliens. How do we know that they are telepathic? I don't even think they look like ""greys"", the gray alien image appeared in scifi way before the rise in UFO sightings, in early XX, or late XIX century (I don't remember."
2021-02-02 06:03:03,aliens,[deleted]
2021-02-02 06:02:25,aliens,">its really not that hard to believe in something

Uh, yeah dude thats the problem. This post literally sounds like op’s friend found his first conspiracy forum and took the first details he saw and made a story out of it. Elon, Area51, Zeta Reticuli....This is the basis for every childishly zany post on conspiracy forums. They just recycle the same talking points. Its way too easy to believe... People need to choose to do the hard thing and be skeptical rather than throwing common sense off a cliff and fully believing whatever they read about area 51 that day."
2021-02-02 06:01:50,aliens," ""I am not allowed to say, but I will say that once I was briefed I had a crisis and had to come to terms with a new reality."" 

what a shithouse.

You're around a campfire, presumably in the middle of nowhere, with a select few individuals. 

Why would you not just subtly drop that you know. That's the only problem I have with this.

Them using the magnetic field to travel does make sense though, its sort of how a bumper cart/dodgems ring works."
2021-02-02 05:59:37,aliens,"Not yet. More podcast listening today at work. 

I’m going to listen to the corbell episodes on JRE, then maybe if that doesn’t do it broaden to other podcasts with Tom DeLonge"
2021-02-02 05:57:14,aliens,Did you find it?
2021-02-02 05:56:32,aliens,">kept heavily under wraps because it would collapse the economy and cause wars

This makes no sense. Since when has the US ever decided to hold back technology in fear of economic collapse? We literally are a country built on doing the exact opposite. We push technology and then we use it, and then we profit. See Hiroshima/Nagasaki. 

>Elon Musk is aware but can’t say anything

lmao I eye rolled so hard at this part. If a story goes out of its way just to mention Elon for no reason you can almost guarantee its some conspiracy nut making it up.

Ugh, at this point this person just doesn’t sound intelligent. They just took talking points from a conspiracy forum (zeta reticuli, Elon, Area 51, magnetic fields) and connected them. I do not believe thier story. Too lacking in detail. Too childishly zany."
2021-02-02 05:52:54,aliens,My uncle works from nintendo and says that if you use strength on the truck by the SS Anne that mew will come out and you can catch him
2021-02-02 05:49:16,aliens,[removed]
2021-02-02 05:48:48,aliens,Great story!!
2021-02-02 05:45:02,aliens,"Right, solar energy is ""free,"" but there's still big hurdles to harness it"
2021-02-02 05:40:53,aliens,"I don't ""hate"" Greer. I used to really like Greer, especially after unacknowledged. Since CE5 he seems to have flipped the script, so to speak, in regards to wanting money for knowledge. His ambassador program is $40 a month, $10 for the app, etc. I'm not concerned about paying $10 for an app, but it will limit the ability to spread the message. People need to understand that humans are a far greater threat to our survival than any outside influence from ET's. If anyone has any doubts that ETs exist and that we possess their craft they really need to do the research. Greer has compiled a phenomenal archive of material but he needs better distribution techniques. His ego and attitude during interviews is what turned me off from him."
2021-02-02 05:22:05,aliens,Idk White House seems pretty protected to me..
2021-02-02 05:17:54,aliens,I understand about the 0 energy and collapse of infrastructure if were available to the public.
2021-02-02 05:12:44,aliens,Yeah but this is classified information though. Someone revealing classified information would get criminally charged. It would be stupid for a government employee to risk going in prison by telling someone this type of info.
2021-02-02 05:10:31,aliens,Yeah good point but in your example you're not using magnetism as a way of propulsion though. You are using it as a way to navigate on earth just like how modern aircraft sometimes use the earth's magnetic field for the same thing. My point was that magnetism and gravity weren't the same thing because he claimed that the ship used both to fly. But he explained in a way that made it seem as if he thought that they were both the same thing. Unless he meant to say that they use it to navigate like how you were explaining in your example.
2021-02-02 04:58:22,aliens,"Ah yes, your friend told you and now you're telling the internet. Absolutely no proof whatsoever or anything scientifically sound just...your friend said. 

And you're confused why people aren't taking you seriously. Some folk likely aren't as gullible as you."
2021-02-02 04:58:14,aliens,"And far-left people cant even decide what gender they are. Maybe aliens wont visit us becouse of far left and right people. We are all clowns and sry for bad english, but both teams are idiots. Right people might attack on sight and aliens might run away when they see lefties what they do to their bodies becouse they are not satisfied with their gender. Hell, they will try to force their lgbtwtf culture upon them. Lets be honest,both teams are toxic and im the same as them. I would like to find common language with left people. I know there are good folk among them"
2021-02-02 04:54:05,aliens,I know what you mean.
2021-02-02 04:53:49,aliens,"In where I am struggling with this theory is: ""How they manage to survive in their ships when they reach these tremendous speeds if they just move with the magnetic fields of Earth?"""
2021-02-02 04:41:50,aliens,"Assuming the worst would be assuming they're all psychopaths.  No I'm assuming what's most realistic.

As for why having blind faith in the good will of aliens is bad.  Well they might actually be real, and just assuming they have the best intentions is dangerous.  Is far better to be cautious in your dealings.  Especially when they ask for consent to do something.  They likely have laws, rules, government and restrictions and just consenting to everything because you assume the best can lead down a bad path.  Same as selling out the world to the first aliens we meet.  They might be the worst choice amongst many."
2021-02-02 04:41:45,aliens,"I think the only time we’ll ever truly know is if a world leader or top official goes rogue and spills the beans to the masses without warning, or the visitors show up á la District 9/Arrival/Independence Day and there’s absolutely no denying it at that point. If the latter happens, the government’s hand would be forced, in my opinion, to explain that they’ve known about this for X time."
2021-02-02 04:26:17,aliens,If we fought wars for costly to run sources (oil) we’ll fight wars for free ones
2021-02-02 04:24:39,aliens,Okay. All I want is the plane type. I work in aviation and if he gives me a bullshit answer I’ll know
2021-02-02 04:23:21,aliens,"Ironically, If we were exposed to the existence of aliens, it would most likely make us forget about our difference."
2021-02-02 04:20:43,aliens,"It’s seriously not an argument, but a scientific genetic fact about humans. 

I was trying to make the point that humans, collectively, are still trying to figure out how to organize themselves on this rock; while still holding concepts, like race, to be truth. 

Race doesn’t exist from a genetic standpoint.

I think the main problem here is how information and knowledge gets dispersed to the masses. How to shake the ivory tower so that the bits may fall on the general public? 

If we are still caught up on race- not sure how we would fair when encountering something TOTALLY different. Idk"
2021-02-02 04:10:22,aliens,Thank you for sharing this very captivating story. I can only imagine the feeling after being briefed and having the entire world around you altered in an instant. That’s the part that sticks with me the most to be honest. I do question the whole Elon Musk part tho...
2021-02-02 04:08:15,aliens,"Right, and typically the body dose something pretty miraculous at the end. When you are starting to transition, usually the body puts you to sleep (lots of factors affect this) and you don’t actually experience a lot of pain if any at all. Its as if the soul has already left, or the body knows its time and spares you the suffering of being awake for it. On occasion this is when the person starts to appear in other places to people. And another thing thats almost universal, theres always someone you know that is there noone else can see (usually a family member) to guide you to the next place. Death is a pretty amazing thing, it really is just a transition."
2021-02-02 04:07:39,aliens,[deleted]
2021-02-02 04:07:18,aliens,Not really. There’s thousands of pilots my dude
2021-02-02 03:52:44,aliens,"When we abduct or observe wildlife, we don't try to cover it up. Just like us, they may just pop up, quickly do their thing and go again. They may not have the cloaking technology, or it could be too time consuming to be worth setting up every time."
2021-02-02 03:48:25,aliens,Maybe you wanna share a bit of said story which is real?
2021-02-02 03:48:23,aliens,You should check the definition of lacking
2021-02-02 03:48:23,aliens,Pls add /s I almost downvoted u
2021-02-02 03:47:34,aliens,"I can only imagine...Pain is subjective so it makes it the hardest symptom to treat. But again, in my 15 years of medical experience 95% of patients are telling the truth! Not saying give everyone Dilaudid, but at least treat people with compassion before we dismiss them! I guess this is how I view these personal UFO stories as well."
2021-02-02 03:42:55,aliens,"Empathy doesn't cost a dime! I wish all medical personnel ""believed"" first. Sorry you had a bad experience."
2021-02-02 03:41:34,aliens,I believe you. Try get some more info bro lol.
2021-02-02 03:40:13,aliens,I'm sorry that has been your experience... That is not how it should go.
2021-02-02 03:38:30,aliens,"People won’t believe because it would disrupt their lives. Their “status quo”. Its obvious we’ve been being watched, experimented with etc for thousands of years."
2021-02-02 03:38:14,aliens,"Some of the best weed in the world grows in some of the poorest countries and allowing them to export their weed as a product into the richer western nations would generate a flow of capital going from the west into those poorer countries. This would allow them to upgrade their military apparatus which - in turn - would enable them: when the western nations come along and demand that poorer country's natural resources at a low price, to tell those western countries to fuck off.

Please don't use ufology to confuse people about the geopolitical situation in the world today.

It's important that we understand that situation - and how the alien presence relates to it (and, most importantly, how disclosure will affect it) - but to blithely postulate that there's a race of evil aliens exploiting humanity from behind the scenes is ridiculous.

We have nothing that aliens want or need. And that statement becomes truer, and truer, with every exoplanet that astronomical science discovers.

The universe is composed of pretty much the same stuff no matter where you go in it - and it's infinite, as are the resources available.

Let's put this nonsense about our world being unique, possessing resources that aren't available anywhere else to bed for good - it's just clogging up the conversation like a thrombosis."
2021-02-02 03:38:13,aliens,Photos of the scars if you want to help validate your story. If you can’t provide those scar photos then I’ll take it there are no scars.
2021-02-02 03:37:49,aliens,"It would be great if instead of creating new threads you could just read the removal messages and follow the instructions given there. Also, this topic has been talked about before, you can search for it and add your take in the comments.   


To answer your question what was to be released about UFOs has already been made public. A simple google search would've given you the results you want.  


[https://www.foxnews.com/us/cia-releases-ufo-black-vault-documents-early-how-to-see-them-online](https://www.foxnews.com/us/cia-releases-ufo-black-vault-documents-early-how-to-see-them-online)  


[https://www.theblackvault.com/documentarchive/ufos-the-central-intelligence-agency-cia-collection/](https://www.theblackvault.com/documentarchive/ufos-the-central-intelligence-agency-cia-collection/)"
2021-02-02 03:36:34,aliens,Dolphins emit low frequency sound waves to stun prey. I'd imagine aliens could possess a similar and stronger ability.
2021-02-02 03:33:08,aliens,"In the spirit of the military, or whatever the ""military"" is that handles this issue, I hope they brief people like ""The entirety of human existence is a cosmic joke. You're already dead. Now dig another gun trench, maggot."""
2021-02-02 03:24:20,aliens,"We all believe you, we really do, its just a united we one don't know how to deal with ourselves as we are and to me aliens seem like humans but more evolved and thats not scary in that context but in other ways of the hidden stuff we dont know about its terrifying to us and we personally haven't done anything to an ET body... So i mean im scared of aliens intent but not when it comes to my personal life or true believers who go off of non credential proof that exists to be known... This well, was a nice chat lol"
2021-02-02 03:19:29,aliens,"Thank you, Downvotesohoy, for voting on converter-bot.

This bot wants to find the best and worst bots on Reddit. [You can view results here](https://botrank.pastimes.eu/).

***

^(Even if I don't reply to your comment, I'm still listening for votes. Check the webpage to see if your vote registered!)"
2021-02-02 03:19:16,aliens,Good bot
2021-02-02 03:17:50,aliens,I'd say you're just as naive for instantly believing it.
2021-02-02 03:15:22,aliens,They're very thorough in briefing their airline pilots! 🤣
2021-02-02 03:14:34,aliens,Why would we collapse with zero point energy? Wouldn't it make everything better on the contrary?
