datetime,subreddit,body
2021-02-03 11:17:46,RoastMe,"We can, but we won´t. No need to roast, the picture itself is a pretty good auto-roas"
2021-02-03 11:17:33,RoastMe,"If you connect the dots on her face, you can see Orion, Bootes, and Cassiopeia."
2021-02-03 11:17:28,RoastMe,You look like if the thing was human
2021-02-03 11:17:18,RoastMe,Im suprised no one has said he looks like what Jimmy from GTA would look like in real life
2021-02-03 11:17:15,RoastMe,Soundcloud rapper whose only listener is his mom
2021-02-03 11:17:14,RoastMe,Elton John's aborted fetus.
2021-02-03 11:17:14,RoastMe,If Eminem had a baby with Mrs. Doubtfire this would be it
2021-02-03 11:17:12,RoastMe,You look like every 8 year old starting a youtube video
2021-02-03 11:16:46,RoastMe,"You look like the illegitimate lovechild of prof and elton john, and not in a good way, the only thing you'll be able to produce is sebaceous scalp cysts from all that hair grease"
2021-02-03 11:16:43,RoastMe,If Run dmc never ran....
2021-02-03 11:16:35,RoastMe,Wow dropped out of college to promote anorexia. True role model
2021-02-03 11:16:31,RoastMe,You look like the randomized character in the avatar maker
2021-02-03 11:16:04,RoastMe,Is this the floor model?
2021-02-03 11:15:52,RoastMe,Onlyfans isn't modeling
2021-02-03 11:15:51,RoastMe,You look like a randomized gta online character
2021-02-03 11:15:44,RoastMe,"Cool, your yoruba Gene's are poppin 🤙🏾"
2021-02-03 11:15:38,RoastMe,Nope. You’re way too pretty. I refuse!
2021-02-03 11:15:37,RoastMe,Isn't it so inspirational that someone's great grandma didn't let age stop her from becoming a tryhard rapper?
2021-02-03 11:15:36,RoastMe,Didn't realize Hermione Granger was so abusive. TIL something.
2021-02-03 11:15:27,RoastMe,Wow i knew that kid from toy story that blew up toys would eventually start doing meth
2021-02-03 11:15:25,RoastMe,You’re extremely thinning hair makes you look like some sort of wannabe hip hop Homer Simpson
2021-02-03 11:15:22,RoastMe,No point in destroying somebody who already looks destroyed asf
2021-02-03 11:15:10,RoastMe,"Don't need to, you already destroyed yourself."
2021-02-03 11:15:05,RoastMe,The Rocket Man in the flesh
2021-02-03 11:14:56,RoastMe,You look like you're gonna tell me that my windows 10 laptop has detected a harmful virus.
2021-02-03 11:14:54,RoastMe,LMAO
2021-02-03 11:14:54,RoastMe,"Thought you were an 11 year old fat kid, and the “ work place” looks as useless as you."
2021-02-03 11:14:22,RoastMe,Looks like genetics already did.
2021-02-03 11:14:18,RoastMe,"You look like a hipster Neil from The Santa Clause

Also congrats on getting out of the abusive relationship"
2021-02-03 11:14:00,RoastMe,18???? More like 18 months...wth...
2021-02-03 11:13:53,RoastMe,Yum 😋
2021-02-03 11:13:49,RoastMe,Did you make your glasses from drinking straws and cling film during crafts lesson?
2021-02-03 11:13:45,RoastMe,Your ass-chin is weak.
2021-02-03 11:13:42,RoastMe,Dry as a camels asshole in a sandstorm at 120 degrees
2021-02-03 11:13:27,RoastMe,Tip 11# Please listen to these people
2021-02-03 11:13:26,RoastMe,Return those eyebrows from whomever you stole them from.
2021-02-02 08:03:14,RoastMe,Where did you get your to pay because they ripped you off man
2021-02-02 08:02:56,RoastMe,Dependa things. With the navy it's even easier. They're so starved any piece of meat will do.
2021-02-02 08:02:56,RoastMe,well we know who the lawyer is atleast
2021-02-02 08:02:55,RoastMe,Dollar store Jimmy Neutron looking ass
2021-02-02 08:02:45,RoastMe,"Hey Frankenstein, the forehead scar healed nicely! Hope you didn’t photoshop out the neck bolts."
2021-02-02 08:02:39,RoastMe,"""Pine For Him"""
2021-02-02 08:02:36,RoastMe,It’s not a phase mom
2021-02-02 08:02:32,RoastMe,You look like you cut your bowl cut with a cup
2021-02-02 08:02:11,RoastMe,[deleted]
2021-02-02 08:01:55,RoastMe,"So you see...
We have to roast the cow to a edible temperature."
2021-02-02 08:01:46,RoastMe,Megamind head looking ass
2021-02-02 08:01:39,RoastMe,You look like one of those teenage boys who tried to be Emo
2021-02-02 08:01:37,RoastMe,you could of wrote that on a poste-it
2021-02-02 08:01:28,RoastMe,you look like the kid that asks for candy in christmas movies
2021-02-02 08:01:07,RoastMe,You look like Sam Smith on meth
2021-02-02 08:00:57,RoastMe,Or talk to it
2021-02-02 08:00:49,RoastMe,Look look like that one person to tell on a teacher because they Didn’t wanna play with you
2021-02-02 08:00:40,RoastMe,I think we can. Just don't put them in gas cabins
2021-02-02 08:00:37,RoastMe,I think you’ve seen enough light at the ER
2021-02-02 08:00:34,RoastMe,"the dog is completely unrelated, unlike you"
2021-02-02 07:59:59,RoastMe,You look like a crack attic trying to give some weed to your six-year-old cousin
2021-02-02 07:59:54,RoastMe,"Hey! Vsauce, Michael here. What is the length between these ass cheeks? To answer that, we first have to answer how large the size of the penis is."
2021-02-02 07:59:33,RoastMe,Haaa in a back alley? Unlikely.
2021-02-02 07:58:51,RoastMe,Huh...good point
2021-02-02 07:58:46,RoastMe,You look like Jim Carrey but if there was no budget
2021-02-02 07:58:44,RoastMe,I'd settle for anything if I was you
2021-02-02 07:58:19,RoastMe,"i would roast you, but im afraid to look... i might turn into stone... or mud..."
2021-02-02 07:58:17,RoastMe,Bobble-head Ben Affleck
2021-02-02 07:57:36,RoastMe,I call it my goat beard
2021-02-02 07:57:21,RoastMe,You have bad taste
2021-02-02 07:56:22,RoastMe,So I guess Harry Potter now makes meth instead of magic.
2021-02-02 07:56:15,RoastMe,That's a nice break from tossing truckers' salads
2021-02-02 07:56:10,RoastMe,pee pee herman
2021-02-02 07:56:02,RoastMe,"Dwayne ""The glock"" Johnson
""Can you smell who this glock is cookin?!"""
2021-02-02 07:55:58,RoastMe,you look like the villain before the terrible disaster
2021-02-02 07:55:20,RoastMe,K pop  took a sad turn
2021-02-02 07:55:00,RoastMe,im sure the electricity your brain uses to get ideas from the too of your head to the rest of the brain could generate enough light already
2021-02-02 07:54:41,RoastMe,"Eminem cancer patient.
""That's an awfully long anesthetic shot."""
2021-02-02 07:54:01,RoastMe,I thought you were supposed to get Bell's Palsy from the vaccine
2021-02-02 07:53:57,RoastMe,Hee hee on crack
2021-02-02 07:53:53,RoastMe,"I'm sorry, but sticking a bar magnet through your prince Albert piercing doesnt mean your bipolar."
2021-02-02 07:53:40,RoastMe,That salad has more personality than you.
2021-02-02 07:53:32,RoastMe,7 Ex girlfriends... what happened to your other 3 fingers?
2021-02-02 07:53:28,RoastMe,More like a dunce than a prince
2021-02-02 07:52:58,RoastMe,You look like human mega mind
2021-02-02 07:52:47,RoastMe,"Damn covid really did put up a fight, your eye tells half the story"
2021-02-02 07:52:44,RoastMe,"Your adhd meds made you lose your appetite for the first 2-4 weeks and that made you think that you're losing weight, so you stopped eating. Don't say it's weird, because that happened to me. But it's still funny when it happens to other people though!"
2021-02-02 07:52:43,RoastMe,Your more plain than your own salad
2021-02-02 07:52:01,RoastMe,You dont even have a hairline. How ima make a joke about it?
2021-02-02 07:51:33,RoastMe,Thanks 🤣🤣🤣
2021-02-02 07:51:32,RoastMe,"Nah I just saw other people doing it lol

E: But yes, I've heard that lots haha"
2021-02-02 07:51:12,RoastMe,Damn your brain is so messed up you cant pose for a mirror right.
2021-02-02 07:51:08,RoastMe,I bet you get your head stuck in  a Pringles can
2021-02-02 07:51:02,RoastMe,"Yes Exactly!  LOL  Only in jest, BTW, you are actually quite lovely."
2021-02-02 07:50:33,RoastMe,Sure you are not 50?
2021-02-02 07:50:27,RoastMe,You look like the blue chick from avatar... less attractive and boring.
2021-02-02 07:50:16,RoastMe,"as a fellow jew, I fully support gasiing this ugly sob"
2021-02-02 07:50:04,RoastMe,"As long as you pay for your expenses and then some, there is nothing wrong with it."
2021-02-02 07:50:00,RoastMe,Probably became a vegan in 7th grade because his teacher said he had to.
2021-02-02 07:49:54,RoastMe,Dr eggman
2021-02-02 07:49:17,RoastMe,"I like how he put 22M in the caption, bcuz he knows people are confused about his gender."
2021-02-02 07:48:16,RoastMe,This homeless lookin bitch probably drinks diet coke because it's the closest thing they can get to an addiction.
2021-02-02 07:48:14,RoastMe,Gay thor.
2021-02-02 07:48:07,RoastMe,[deleted]
